Keyword,Volume,KD %,CPC (USD)
hotel software,2400,76,15.52
hotel communication,70,19,5.61
what is hotel software,40,19,0
hotel guest communication software,30,0,0.29
how do hotels communicate with guests,30,0,0
what does communications accessible hotel room mean,30,0,0.33
what is the best hotel management software,30,0,0.36
hotel mangement,30,28,6.59
hotel communication software,20,0,0.57
how to automate hotel guest communication,20,0,0
what does communication accessible mean hotel,20,0,0.33
what does communication accessible mean in a hotel room,20,0,0.33
what does communications accessible mean for a hotel room,20,0,0.33
what does communications accessible mean in a hotel,20,0,0.33
what is a communications accessible hotel room,20,0,0.33
what is communication accessible hotel room,20,0,0.33
how does hotel management software work,20,0,0
how hotels use software for data-driven decisions,20,0,0
how much does hotel management software cost,20,0,0
how to choose hotel management software,20,0,0
how to choose the best revenue management software for hotel,20,0,0
how to implement hotel software solutions,20,0,0
how to learn opera hotel software,20,0,2.65
is it top analytics software for hotel industry b2b,20,0,0
what animation software does hazbin hotel use,20,0,0.33
what are hotel software solutions,20,0,0
what is best hotel management software,20,0,0
what is hotel management software,20,0,0.29
what is hotel pms software,20,0,0.33
what is office hoteling software,20,0,0
what is opera hotel software,20,0,0.33
what is opera software for hotels,20,0,0.29
what is pms in hotel software,20,0,0.33
what software do hotels use,20,0,0.73
what software do hotels use for reservations,20,0,14.25
what software does hilton hotels use,20,0,0.33
what software system do hotels use,20,0,0
what's the best front desk software for hotels,20,0,0
when to upgrade hotel software solutions,20,0,0
which software is used in hotel industry,20,0,0.79
hotel mangement system,20,0,18.31
hotel and restaurant mangement,20,0,7.17
hotel software enhance communication with guests before arrival,10,0,0
hotel software guest communication before arrival,10,0,0
internal employee communication software for hotels,10,0,0
how hotels can automate guest communications,10,0,0
how to communicate with guest in hotel,10,0,0
how to improve communication during shift handovers in hotels,10,0,0
what is the best ai hotel chatbot for guest communication,10,0,0
are hotel software solutions worth it,10,0,0
do hotels use crm software,10,0,0
how dynamic hotel pricing software works,10,0,0
how hotel software improves guest experience,10,0,0
how many software used in hotel industry,10,0,0
how to choose the best revenue management software for hotels,10,0,0
how to improve hotel staff efficiency with software,10,0,0
how to use delphi hotel software,10,0,0
how to use opera hotel software,10,0,0
how to use opera software for hotels,10,0,0.86
is it best software for hotel data analytics,10,0,0
what is delphi software hotel,10,0,0
what is ideas hotel software,10,0,0
what is ids software for hotel,10,0,0
what is the best reputation management software for hotels,10,0,0
what is the software that connect hotels data to quickbooks,10,0,0
what software do most hotels use,10,0,0
what software systems do hotels use,10,0,0
what's the best ai software for hotels,10,0,0
what's the best hotel channel manager software for businesses,10,0,0
which is the best hotel management software,10,0,0
which software is best for hotel management,10,0,0
whatsapp for hotels,10,0,0.02
hotel+mangement,10,0,0
